{
  "$schema": "../../../schemas/fixtures/pathway1/hit.schema.json",
  "research_boundary": "Research use only. Not for diagnosis, treatment, cure claims, prescribing, clinical deployment, regulatory compliance, or drug-safety certification.",
  "hit_id": "P1-HIT-CACNA1C-001",
  "target_id": "uniprot:Q13936",
  "smiles": "CCOC(=O)C1=C(C)NC(C)=C(C(=O)OCC)C1c1ccccc1[N+](=O)[O-]",
  "predicted_pIC50": 7.4,
  "admet_panel": {
    "logP": 3.6,
    "tpsa": 104.5,
    "BBB_penetration_prob": 0.35,
    "hERG_IC50_uM": 29.7,
    "hepatotox_flag": false,
    "oral_bioavailability_prob": 0.62,
    "esol_logS": -4.4,
    "lipinski_violations": 0
  },
  "selectivity_score": 0.66,
  "synthetic_accessibility": 2.4,
  "generation_method": "DiffSBDD",
  "confidence_tier": "B",
  "stub_provenance_note": "Stub canned hit for CACNA1C (CaV1.2/ICaL). Dihydropyridine-like scaffold. ADMET from Chemprop v2 stub; pIC50 from Boltz-2 stub. Real values require Runpod GPU adapters."
}
